{
  "schema_version": "1.0.0",
  "passport_id": "PASSPORT-000003",
  "passport_version": "1.0.0",
  "benchmark_id": "BENCHMARK-000003",
  "candidate_id": "CANDIDATE-000003",
  "title": "Known-answer Schwarzschild exterior tensor benchmark",
  "classification": "ESTABLISHED_NON_NOVEL_CURVED_GEOMETRY",
  "capability_added": "Verify one position-dependent curved metric through symbolic derivatives, connection, curvature, vacuum tensors, and a curvature invariant.",
  "scientific_review": "REQUESTED",
  "domain": {
    "parameter_constraints": ["M > 0"],
    "coordinate_ranges": {"t": "all real", "r": "r > 2*M", "theta": "0 < theta < pi", "phi": "0 <= phi < 2*pi"},
    "excluded_sets": ["r = 0 curvature singularity", "r = 2*M Schwarzschild-coordinate horizon boundary", "theta = 0 and theta = pi spherical-coordinate axis degeneracy"],
    "chart_coverage": "Exterior curvature-coordinate patch only; no claim about a horizon-penetrating or maximal extension."
  },
  "conventions": {
    "metric_signature": "-+++",
    "units": "geometrized units G = c = 1",
    "cosmological_constant": 0,
    "riemann_tensor_definition": "R^rho_{sigma mu nu} = d_mu Gamma^rho_{nu sigma} - d_nu Gamma^rho_{mu sigma} + Gamma^rho_{mu lambda} Gamma^lambda_{nu sigma} - Gamma^rho_{nu lambda} Gamma^lambda_{mu sigma}",
    "ricci_contraction": "R_{sigma nu} = R^rho_{sigma rho nu}"
  },
  "expected_results": {
    "coordinates": ["t", "r", "theta", "phi"],
    "metric": [["-(1 - 2*M/r)", 0, 0, 0], [0, "1/(1 - 2*M/r)", 0, 0], [0, 0, "r**2", 0], [0, 0, 0, "r**2*sin(theta)**2"]],
    "inverse_metric": [["-1/(1 - 2*M/r)", 0, 0, 0], [0, "1 - 2*M/r", 0, 0], [0, 0, "1/r**2", 0], [0, 0, 0, "1/(r**2*sin(theta)**2)"]],
    "metric_determinant": "-r**4*sin(theta)**2",
    "nonzero_christoffel": {
      "0,0,1": "M/(r*(r - 2*M))", "0,1,0": "M/(r*(r - 2*M))", "1,0,0": "M*(r - 2*M)/r**3",
      "1,1,1": "-M/(r*(r - 2*M))", "1,2,2": "2*M - r", "1,3,3": "(2*M - r)*sin(theta)**2",
      "2,1,2": "1/r", "2,2,1": "1/r", "2,3,3": "-sin(theta)*cos(theta)",
      "3,1,3": "1/r", "3,3,1": "1/r", "3,2,3": "cos(theta)/sin(theta)", "3,3,2": "cos(theta)/sin(theta)"
    },
    "representative_riemann": {
      "0,1,0,1": "2*M/(r**2*(r - 2*M))", "1,0,1,0": "-2*M*(r - 2*M)/r**4",
      "0,2,0,2": "-M/r", "1,2,1,2": "-M/r", "2,3,2,3": "2*M*sin(theta)**2/r"
    },
    "ricci_tensor": [[0, 0, 0, 0], [0, 0, 0, 0], [0, 0, 0, 0], [0, 0, 0, 0]],
    "ricci_scalar": 0,
    "einstein_tensor": [[0, 0, 0, 0], [0, 0, 0, 0], [0, 0, 0, 0], [0, 0, 0, 0]],
    "kretschmann_scalar": "48*M**2/r**6",
    "stress_energy": "all zero in the exterior vacuum domain",
    "tolerance": "exact symbolic equality after simplification"
  },
  "preregistered_checks": [
    "schema.candidate.v2", "schema.passport.curved.v1", "metric.dimension", "metric.symmetry", "metric.components",
    "metric.determinant", "metric.inverse", "domain.schwarzschild_exterior", "symbolic.position_dependence",
    "connection.christoffel", "curvature.riemann_nonzero", "curvature.ricci_zero", "curvature.ricci_scalar_zero",
    "curvature.einstein_zero", "curvature.kretschmann", "conventions.tensor_signs", "physics.vacuum_exterior"
  ],
  "negative_cases": [
    {"case": "Change the time-time metric coefficient sign or mass factor.", "expected_failure": "metric.components"},
    {"case": "Declare M <= 0 or allow r <= 2*M in the evaluated chart.", "expected_failure": "domain.schwarzschild_exterior"},
    {"case": "Remove the sin(theta)**2 factor from g_phi_phi.", "expected_failure": "metric.components"},
    {"case": "Perturb the radial metric inverse factor.", "expected_failure": "metric.inverse"},
    {"case": "Flip the declared Riemann convention without transforming expected components.", "expected_failure": "conventions.tensor_signs"},
    {"case": "Report every Riemann component as zero.", "expected_failure": "curvature.riemann_nonzero"},
    {"case": "Introduce a nonzero Ricci or Einstein component in the exterior.", "expected_failure": "curvature.ricci_zero"},
    {"case": "Replace the curvature invariant with a constant or zero.", "expected_failure": "curvature.kretschmann"},
    {"case": "Evaluate theta at a spherical-coordinate axis while claiming the chart is nonsingular there.", "expected_failure": "domain.schwarzschild_exterior"}
  ],
  "unsupported_properties": [
    "The Schwarzschild interior, horizon-penetrating charts, or maximal extension",
    "Matter-source reconstruction inside the central body",
    "Geodesic integration, orbit stability, travel time, or tidal-force safety",
    "Perturbative or nonlinear stability of the spacetime",
    "Numerical relativity, dynamical collapse, rotation, or charge",
    "Any novel geometry, device, engineering, or transportation claim"
  ],
  "references": [
    {"title": "On the Gravitational Field of a Mass Point According to Einstein's Theory", "url": "https://ui.adsabs.harvard.edu/abs/1916SPAW.......189S/abstract", "purpose": "Original Schwarzschild solution."},
    {"title": "Lectures on General Relativity", "url": "https://www.damtp.cam.ac.uk/user/tong/gr.html", "purpose": "Metric, vacuum equation, exterior domain, horizon, and singularity conventions."},
    {"title": "EinsteinPy symbolic module", "url": "https://docs.einsteinpy.org/en/stable/api/symbolic/symbolic_index.html", "purpose": "Documented second symbolic solver interface."}
  ],
  "provenance": {"created_by": "ChefMrFrizzle with Codex", "created_at": "2026-08-09T00:00:00Z", "license": "Apache-2.0", "human_scientific_review_required": true}
}
